{
  "$schema": "../../_schemas/ctxux_screen.schema.json",
  "id": "documents-view",
  "title": "Просмотр документов",
  "desc": "Экран просмотра и поиска документов проекта с поддержкой фильтров и предпросмотра.",
  "local_principles": [
    {
      "id": "progressive-disclosure",
      "title": "Последовательное раскрытие",
      "rationale": "Показывать минимум по умолчанию и раскрывать детали по требованию.",
      "acceptance": [
        "Поиск доступен из одного фокуса",
        "Фильтры применяются без перезагрузки экрана"
      ],
      "telemetry": [
        "documents_search"
      ],
      "related_principles": [
        "one-screen-one-action",
        "minimize-required-input"
      ],
      "global_principle_ids": [
        "one-screen-one-action",
        "minimize-required-input"
      ],
      "user_story_ids": ["us-13", "us-14"]
    }
  ],
  "refs": {
    "UserStory": ["us-13", "us-14"],
    "HIG": ["search-bar", "list-filtering"],
    "Wireframes": ["Figma:DL-Docs-View-v2"],
    "DesignSystem": ["List", "SearchBar"],
    "GlobalPrinciple": ["one-screen-one-action", "minimize-required-input"],
    "UserFlow": ["documents-view"]
  }
}
